{
  "projection_version": "1.2.0",
  "generated_at": "2026-07-26T20:15:00Z",
  "counts": {
    "research": 3,
    "findings": 0,
    "mechanisms": 3,
    "engineering_cases": 3,
    "sources": 18,
    "conjectures": 4,
    "lineage": 4
  },
  "research": [
    {
      "id": "b7ff216f4eec6e58",
      "slug": "memory-systems-v1",
      "title": "Memory systems comparison v1",
      "summary": "A vendor-comparison pre-registration retained as an inspectable withdrawal. It was never executed.",
      "status": "withdrawn",
      "validity": "withdrawn",
      "registered_at": "2026-04-19T04:25:00Z",
      "updated_at": "2026-07-12T12:55:27Z",
      "superseded_by": null,
      "public_artifact": "/artifacts/memory-systems-v1/",
      "provenance": {
        "claim_id": "b7ff216f4eec6e58",
        "decision_id": "8c589b2448a76a6b",
        "evidence_ids": []
      }
    },
    {
      "id": "bb7cee596f94289b",
      "slug": "memory-systems-control-v1",
      "title": "Memory systems control arm",
      "summary": "A control-arm pre-registration created before observation and withdrawn with the unauthorized vendor route.",
      "status": "withdrawn",
      "validity": "withdrawn",
      "registered_at": "2026-07-12T12:40:20Z",
      "updated_at": "2026-07-12T12:55:27Z",
      "superseded_by": null,
      "public_artifact": "/artifacts/memory-systems-v1/",
      "provenance": {
        "claim_id": "bb7cee596f94289b",
        "decision_id": "e29e6d9cc80c8b72",
        "evidence_ids": []
      }
    },
    {
      "id": "bda4396c7638e63f",
      "slug": "artifact-coherence-transfer-v1",
      "title": "Artifact coherence transfer study v1",
      "summary": "A prospective study invalidated before measurement after a protocol deviation and an independently identified detector defect.",
      "status": "invalidated",
      "validity": "invalid",
      "registered_at": "2026-07-12T13:40:27Z",
      "updated_at": "2026-07-12T16:33:51Z",
      "superseded_by": null,
      "public_artifact": "/artifacts/artifact-coherence-transfer-v1/",
      "provenance": {
        "claim_id": "bda4396c7638e63f",
        "decision_id": "c40c91e1d1b56853",
        "evidence_ids": []
      }
    }
  ],
  "findings": [],
  "mechanisms": [
    {
      "id": "mechanism:canon-envelope-store",
      "title": "Canon envelope store",
      "summary": "Append-only, validator-gated records for Claims, Evidence, Decisions, Policies, and events.",
      "status": "operational",
      "public_artifact": "/method/#canon"
    },
    {
      "id": "mechanism:frozen-promotion-gates",
      "title": "Frozen promotion gates",
      "summary": "Evaluation thresholds are bound to Claims before observation and cannot be amended afterward.",
      "status": "operational",
      "public_artifact": "/method/#preregistration"
    },
    {
      "id": "mechanism:publication-guard",
      "title": "Decision-backed publication guard",
      "summary": "The static build refuses result publication without a valid terminal Decision and intact canon lineage.",
      "status": "operational",
      "public_artifact": "/method/#publication"
    }
  ],
  "engineering_cases": [
    {
      "id": "case:canon-publication-guard",
      "slug": "canon-publication-guard",
      "title": "The build refuses unsupported findings",
      "summary": "Canon validation and publication guards run before every site build, rejecting results without a valid Decision-to-Evidence chain.",
      "label": "engineering case study",
      "status": "operational",
      "learned": "Moving the epistemic rule into the build makes unsupported publication unavailable rather than merely discouraged.",
      "limits": "The guard proves contract enforcement, not the truth of any future Evidence.",
      "source_links": [
        "https://github.com/evanfollis/synaplex/blob/main/lab/canon/guard.py",
        "https://github.com/evanfollis/synaplex/blob/main/lab/canon/test_canon.py"
      ]
    },
    {
      "id": "case:immutable-public-release",
      "slug": "immutable-public-release",
      "title": "One digest, two public readers",
      "summary": "A deterministic projection is generated once, consumed by human pages and JSON clients, and deployed as an immutable Pages release.",
      "label": "engineering case study",
      "status": "operational",
      "learned": "Binding both readers to one digest turns disagreement into measurable drift.",
      "limits": "This is an implementation result, not evidence that the knowledge methodology produces true findings.",
      "source_links": [
        "https://github.com/evanfollis/synaplex/commit/6579bb2",
        "https://synaplex.ai/knowledge/public-projection.json"
      ]
    },
    {
      "id": "case:lossless-telemetry-fallback",
      "slug": "lossless-telemetry-fallback",
      "title": "Telemetry failure stays off the hot path",
      "summary": "Primary telemetry append failure falls back to an ownership-checked spool while research execution continues.",
      "label": "engineering case study",
      "status": "operational",
      "learned": "A receipt can preserve delivery degradation without turning optional observability into a system-wide stop condition.",
      "limits": "Tests establish software behavior; they do not establish an empirical law about all telemetry systems.",
      "source_links": [
        "https://github.com/evanfollis/synaplex/blob/main/intake/friction.py",
        "https://github.com/evanfollis/synaplex/blob/main/intake/test_friction_resilience.py"
      ]
    }
  ],
  "sources": [
    {
      "id": "src:15706c04a748f182",
      "title": "The Raft Consensus Algorithm",
      "url": "https://raft.github.io/",
      "retrieved_at": "2026-07-19T16:10:00Z",
      "source_class": "official_archive",
      "domain": "distributed_systems",
      "author_publisher": "Ongaro and Ousterhout",
      "content_digest": "sha256:15706c04a748f182964896c0e105ebea75212fee99a29a224ddaf5c211b3748c",
      "access_license": "Public author-maintained paper archive",
      "quality": 0.93
    },
    {
      "id": "src:21c1cdce6ab0e550",
      "title": "HTTP Semantics, RFC 9110",
      "url": "https://www.rfc-editor.org/rfc/rfc9110.txt",
      "retrieved_at": "2026-07-19T16:10:00Z",
      "source_class": "standard",
      "domain": "distributed_systems",
      "author_publisher": "IETF / RFC Editor",
      "content_digest": "sha256:21c1cdce6ab0e5509b04d84a28000836c7a087cf786efe6f04877ebfff47232a",
      "access_license": "IETF Trust legal provisions",
      "quality": 0.98
    },
    {
      "id": "src:22a3e907ec8e8834",
      "title": "Cross-validating causal discovery via Leave-One-Variable-Out",
      "url": "https://proceedings.mlr.press/v275/schkoda25a.html",
      "retrieved_at": "2026-07-19T16:10:00Z",
      "source_class": "peer_reviewed_paper",
      "domain": "causal_scientific_method",
      "author_publisher": "Schkoda et al. / PMLR",
      "content_digest": "sha256:22a3e907ec8e88341e9073c7609d57a1ade5a2cb965d2dc14ae940467db1c7af",
      "access_license": "PMLR open proceedings",
      "quality": 0.94
    },
    {
      "id": "src:3a7e24f19d4a81af",
      "title": "Evaluating large language model agents for automation of atomic force microscopy",
      "url": "https://www.nature.com/articles/s41467-025-64105-7",
      "retrieved_at": "2026-07-19T16:10:00Z",
      "source_class": "peer_reviewed_paper",
      "domain": "ai_systems",
      "author_publisher": "Nature Communications",
      "content_digest": "sha256:3a7e24f19d4a81afc0706bc13356a310f9549a1c9c21da6e8ab1999743c41aae",
      "access_license": "Open-access article; publisher license on source page",
      "quality": 0.94
    },
    {
      "id": "src:3b70d9477106c9f1",
      "title": "Expert-In-The-Loop Causal Discovery",
      "url": "https://proceedings.mlr.press/v286/ankan25a.html",
      "retrieved_at": "2026-07-19T16:10:00Z",
      "source_class": "peer_reviewed_paper",
      "domain": "causal_scientific_method",
      "author_publisher": "Ankan and Textor / PMLR",
      "content_digest": "sha256:3b70d9477106c9f107b9bf3accaf82a873c2c5b1c208e3f57261c7799aad6a70",
      "access_license": "PMLR open proceedings",
      "quality": 0.94
    },
    {
      "id": "src:78904823f90c89e5",
      "title": "AutoLabs: cognitive multi-agent systems with self-correction for autonomous chemical experimentation",
      "url": "https://www.nature.com/articles/s41598-026-45593-z",
      "retrieved_at": "2026-07-19T16:10:00Z",
      "source_class": "peer_reviewed_paper",
      "domain": "ai_systems",
      "author_publisher": "Panapitiya et al. / Scientific Reports",
      "content_digest": "sha256:78904823f90c89e5c56ace3428647634da1cf29cdfaf918a76226ea2d1633a32",
      "access_license": "Open-access article; publisher license on source page",
      "quality": 0.94
    },
    {
      "id": "src:8efadf322e82ab31",
      "title": "Economic governance: the organization of cooperation",
      "url": "https://www.nobelprize.org/prizes/economic-sciences/2009/press-release/",
      "retrieved_at": "2026-07-19T16:10:00Z",
      "source_class": "official_report",
      "domain": "organization_economics",
      "author_publisher": "Nobel Prize Outreach",
      "content_digest": "sha256:8efadf322e82ab31cf39021fe42e579a795ae67925cb4f8cc6e500485e7988cf",
      "access_license": "Public official prize material",
      "quality": 0.9
    },
    {
      "id": "src:9324ca1dc67e70b8",
      "title": "Artificial intelligence tools expand scientists' impact but contract science's focus",
      "url": "https://www.nature.com/articles/s41586-025-09922-y",
      "retrieved_at": "2026-07-19T16:10:00Z",
      "source_class": "peer_reviewed_paper",
      "domain": "organization_economics",
      "author_publisher": "Hao et al. / Nature",
      "content_digest": "sha256:9324ca1dc67e70b89930d8268951e7d15688349968819fb2d9798940ae46b7f4",